B1: Event | C1: Scriptural Reference | D1: Biblical Number | E1: Estimate
A2: 1 | B2: The Flood of Noah | C2: Gen 7:23 | E2: 20000000
A3: =A2+1 -> 2 | B3: Abraham’s war to rescue Lot | C3: Gen 14:17-19 | E3: 1000
A4: =A3+1 -> 3 | B4: Sodom and Gomorrah | C4: Gen 19:24 | E4: 2000
A5: =A4+1 -> 4 | B5: Lot's wife | C5: Gen 19:26 | D5: 1 | E5: 1
A6: =A5+1 -> 5 | B6: The Shechem and Dinah love story/massacre | C6: Gen 34:1-31, Jud 9:2-3 | D6: 2 | E6: 1000
A7: =A6+1 -> 6 | B7: Er for being wicked in the sight of the Lord | C7: Gen 38:7 | D7: 1 | E7: 1
A8: =A7+1 -> 7 | B8: Onan for spilling his seed | C8: Gen 38:10 | D8: 1 | E8: 1
A9: =A8+1 -> 8 | B9: God’s seven year, world-wide famine | C9: Gen 41:25-54 | E9: 70000
A10: =A9+1 -> 9 | B10: The Seventh Plague of Egypt: Hail | C10: Ex 9:25 | E10: 300000
A11: =A10+1 -> 10 | B11: God killed all the firstborn Egyptian children | C11: Ex 12:229-30 | E11: 500000
A12: =A11+1 -> 11 | B12: God drowned the Egyptian army | C12: Ex 14:8-26 | D12: 600 | E12: 5000
A13: =A12+1 -> 12 | B13: Amalekites | C13: Ex 17:13 | E13: 1000
A14: =A13+1 -> 13 | B14: Who is on the Lord’s side: Forcing friends and family to kill each other | C14: Ex 32:27-28 | D14: 3000 | E14: 3000
A15: =A14+1 -> 14 | B15: The Lord plagued the people because of the calf that Aaron made | C15: Ex 32:35 | E15: 1000
A16: =A15+1 -> 15 | B16: God burned Aaron’s sons to death for offering “strange fire” | C16: Lev 10:1-3 | D16: 2 | E16: 2
A17: =A16+1 -> 16 | B17: A blasphemer is stoned to death | C17: Lev 24:10-23 | D17: 1 | E17: 1
A18: =A17+1 -> 17 | B18: When the people complained, God burned them to death | C18: Num 11:1 | E18: 100
A19: =A18+1 -> 18 | B19: While the flesh was still between their teeth, the Lord smote them with a very great plague | C19: Num 11:33 | E19: 10000
A20: =A19+1 -> 19 | B20: Ten scouts are killed for their honest report | C20: Num 14:35-45 | D20: 10 | E20: 110
A21: =A20+1 -> 20 | B21: A man gathering sticks on the Sabbath day | C21: Num 15:32-35 | D21: 1 | E21: 1
A22: =A21+1 -> 21 | B22: The opposing party is buried alive (along with their families) | C22: Num 16:27 | D22: 3 | E22: 9
A23: =A22+1 -> 22 | B23: God burned 250 people to death for burning incense | C23: Num 16:35 | D23: 250 | E23: 250
A24: =A23+1 -> 23 | B24: God killed 14,700 people for complaining about God’s killings | C24: Num 16:49 | D24: 14700 | E24: 14700
A25: =A24+1 -> 24 | B25: The Massacre of the Aradites | C25: Num 21:1-3 | E25: 3000
A26: =A25+1 -> 25 | B26: God sent fiery serpents to bite the people for complaining about the lack of food and water | C26: Num 21:6 | E26: 100
A27: =A26+1 -> 26 | B27: Phinehas' double murder: A killing to end God’s killing | C27: Num 25:1-11 | D27: 24002 | E27: 24002
A28: =A27+1 -> 27 | B28: The Midianite Massacre: Have you saved all the women alive? | C28: Num 31:1-35 | D28: 6 | E28: 200000
A29: =A28+1 -> 28 | B29: God slowly killed the Israelite army | C29: Dt 2:14-16 | E29: 500000
A30: =A29+1 -> 29 | B30: God the giant killer | C30: Dt 2:21-22 | E30: 5000
A31: =A30+1 -> 30 | B31: God hardens king Sihon’s heart so that all his people can be killed | C31: Dt 2:33-34 | D31: 1 | E31: 3000
A32: =A31+1 -> 31 | B32: All the men, women, and children in 60 cities | C32: Dt 3:6 | E32: 60000
A33: =A32+1 -> 32 | B33: The Jericho massacre | C33: Jos 6:21 | E33: 1000
A34: =A33+1 -> 33 | B34: Achan and his family are stoned and burned to death | C34: Jos 7:10-12, 24-26 | D34: 1 | E34: 5
A35: =A34+1 -> 34 | B35: The Ai massacre | C35: Jos 8:1-25 | E35: 12000
A36: =A35+1 -> 35 | B36: God stops the sun so that Joshua can get his killing done in the daylight | C36: Jos 10:10-11 | E36: 5000
A37: =A36+1 -> 36 | B37: Five kings killed and hung on trees | C37: Jos 10:26 | D37: 5 | E37: 10000
A38: =A37+1 -> 37 | B38: Joshua utterly destroyed all that breathed as the Lord God commanded | C38: Jos 10:28-42 | D38: 7 | E38: 7000
A39: =A38+1 -> 38 | B39: Jabin, Jobab, and all the people of 20 cities | C39: Jos 11:8-12 | D39: 2 | E39: 20000
A40: =A39+1 -> 39 | B40: The Anakim: Some more giant killing | C40: Jos 11:20-21 | E40: 5000
A41: =A40+1 -> 40 | B41: The Lord delivered the Canaanites and the Perizzites | C41: Jg 1:4 | E41: 10000
A42: =A41+1 -> 41 | B42: The Jerusalem massacre | C42: Jg 1:8 | E42: 1000
A43: =A42+1 -> 42 | B43: Five massacres, a wedding, and some God-proof iron chariots | C43: Jg 1:9-25 | E43: 5000
A44: =A43+1 -> 43 | B44: The Lord delivered Chushanrishathaim | C44: Jg 3:7-10 | D44: 1 | E44: 1000
A45: =A44+1 -> 44 | B45: Ehud delivers a message from God | C45: Jg 3:15-22 | D45: 1 | E45: 1
A46: =A45+1 -> 45 | B46: God delivers 10,000 lusty Moabites | C46: Jg 3:28-29 | E46: 10000
A47: =A46+1 -> 46 | B47: Shamgar killed 600 Philistines with an ox goad | C47: Jg 3:31 | D47: 600 | E47: 600
A48: =A47+1 -> 47 | B48: Barak and God massacre the Canaanites | C48: Jg 4:15-16 | E48: 1000
A49: =A48+1 -> 48 | B49: Jael pounds a tent stake through a sleeping man’s skull | C49: Jg 4:18-22 | D49: 1 | E49: 1
A50: =A49+1 -> 49 | B50: Gideon's story: The Lord set every man’s sword against his fellow | C50: Jg 7:22 | E50: 120000
A51: =A50+1 -> 50 | B51: A city is massacred and 1000 people burn to death because of God’s evil spirit | C51: Jg 9:23-27 | D51: 1001 | E51: 2000
A52: =A51+1 -> 51 | B52: The Ammonite massacre | C52: Jg 11:32-33 | E52: 20000
A53: =A52+1 -> 52 | B53: Jephthah’s Daughter | C53: Jg 11:39 | D53: 1 | E53: 1
A54: =A53+1 -> 53 | B54: 42,000 killed for failing the "shibboleth" test | C54: Jg 12:4-7 | D54: 42000 | E54: 42000
A55: =A54+1 -> 54 | B55: The spirit of the Lord came upon Samson and he murdered thirty men for their clothes | C55: Jg 14:19 | D55: 30 | E55: 30
A56: =A55+1 -> 55 | B56: The spirit of the Lord came upon Samson and he killed 1000 men with the jawbone of an ass | C56: Jg 15:14-15 | D56: 1000 | E56: 1000
A57: =A56+1 -> 56 | B57: Samson killed 3000 in a suicide terrorist attack | C57: Jg 16:27-30 | D57: 3000 | E57: 3000
A58: =A57+1 -> 57 | B58: A holy civil war (It had something to do with rotting concubine body part messages) | C58: Jg 20:35-37 | D58: 65100 | E58: 65100
A59: =A58+1 -> 58 | B59: The End of Judges: Two genocides and 200 stolen virgins | C59: Jg 21:10-14 | E59: 4000
A60: =A59+1 -> 59 | B60: God kills Eli’s sons and 34,000 Israelite soldiers | C60: 1 Sam 2:25, 4:11 | D60: 34002 | E60: 34002
A61: =A60+1 -> 60 | B61: God smote them with hemorrhoids in their secret parts | C61: 1 Sam 5:1-12 | E61: 3000
A62: =A61+1 -> 61 | B62: 50,070 killed for looking into the ark of the Lord | C62: 1 Sam 6:19 | D62: 50070 | E62: 50070
A63: =A62+1 -> 62 | B63: The Lord thundered great thunder upon the Philistines | C63: 1 Sam 7:10-11 | E63: 1000
A64: =A63+1 -> 63 | B64: Another Ammonite massacre (and another God-inspired body part message) | C64: 1 Sam 11:6-13 | E64: 1000
A65: =A64+1 -> 64 | B65: Jonathan’s very first slaughter (not counting the one before) | C65: 1 Sam 14:12-14 | D65: 20 | E65: 20
A66: =A65+1 -> 65 | B66: God forced the Philistines to kill each other | C66: 1 Sam 14:20 | E66: 1000
A67: =A66+1 -> 66 | B67: The Amalekite genocide | C67: 1 Sam 15:2-3 | E67: 10000
A68: =A67+1 -> 67 | B68: Samuel hacks Agag to death before the Lord | C68: 1 Sam 15:32-33 | D68: 1 | E68: 1
A69: =A68+1 -> 68 | B69: In the Valley of Elah: Goliath | C69: 1 Sam 17:51, 2 Sam 21:19 | D69: 1 | E69: 1
A70: =A69+1 -> 69 | B70: David buys a wife with 200 Philistines foreskins | C70: 1 Sam 18:27 | D70: 200 | E70: 200
A71: =A70+1 -> 70 | B71: The Lord said to David, Go and smite the Philistines | C71: 1 Sam 23:2-5 | E71: 10000
A72: =A71+1 -> 71 | B72: God killed Nabal (and David got his wife and other stuff) | C72: 1 Sam 25:38 | D72: 1 | E72: 1
A73: =A72+1 -> 72 | B73: David commits random acts of genocide (as a mercenary for the Philistines) | C73: 1 Sam 27:8-11 | E73: 60000
A74: =A73+1 -> 73 | B74: David spends the day killing Amalekites | C74: 1 Sam 30:17 | E74: 1000
A75: =A74+1 -> 74 | B75: God killed Saul (and his sons and soldiers) for not killing all the Amalekites | C75: 1 Sam 31:2, 2 Chr 10:6 | D75: 4 | E75: 100
A76: =A75+1 -> 75 | B76: David kills the messenger | C76: 2 Sam 1:15 | D76: 1 | E76: 1
A77: =A76+1 -> 76 | B77: David killed Rechab and Baanah, cut off their hands and feet, and hung their bodies over the pool | C77: 2 Sam 4:12 | D77: 2 | E77: 2
A78: =A77+1 -> 77 | B78: God helps David smite the Philistines from the front and the rear | C78: 2 Sam 5:19-25 | E78: 2000
A79: =A78+1 -> 78 | B79: God killed Uzzah for trying to keep the ark from falling | C79: 2 Sam 6:6-7, 1 Chr 13:9-10 | D79: 1 | E79: 1
A80: =A79+1 -> 79 | B80: David killed two thirds of the Moabite POWs and enslaved the rest | C80: 2 Sam 8:2 | E80: 667
A81: =A80+1 -> 80 | B81: The Lord gave David victory wherever he went | C81: 2 Sam 8:13, 10:18 | D81: 65850 | E81: 66850
A82: =A81+1 -> 81 | B82: David killed every male in Edom | C82: 2 Sam 8:13, 1 Kg 11:15-16, 1 Chr 18:12, Ps 60:1 | D82: 15000 | E82: 65000
A83: =A82+1 -> 82 | B83: Thus did David unto all the children of Ammon | C83: 2 Sam 8:5, 1 Chr 20:1 | E83: 1000
A84: =A83+1 -> 83 | B84: God slowly kills a baby | C84: 2 Sam 12:14-18 | D84: 1 | E84: 1
A85: =A84+1 -> 84 | B85: Famine and human sacrifice | C85: 2 Sam 21:1-9 | D85: 7 | E85: 3000
A86: =A85+1 -> 85 | B86: David’s mighty men and their amazing killings | C86: 2 Sam 23, 1 Chr 11 | D86: 1403 | E86: 3400
A87: =A86+1 -> 86 | B87: God killed 70,000 because David had a census that God (or Satan) told him to do | C87: 2 Sam 24:15, 1 Chr 21:14 | D87: 70000 | E87: 200000
A88: =A87+1 -> 87 | B88: Solomon carried out the deathbed wish of David by having Joab and Shimei murdered | C88: 1 Kg 2:29-34, 44-46 | D88: 2 | E88: 2
A89: =A88+1 -> 88 | B89: A tale of two prophets | C89: 1 Kg 13:11-24 | D89: 1 | E89: 1
A90: =A89+1 -> 89 | B90: Jeroboam’s son: God kills another child | C90: 1 Kg 14:17 | D90: 1 | E90: 1
A91: =A90+1 -> 90 | B91: Jeroboam’s family | C91: 1 Kg 15:29 | E91: 10
A92: =A91+1 -> 91 | B92: Baasha’s family and friends | C92: 1 Kg 16:11-12 | E92: 20
A93: =A92+1 -> 92 | B93: Zimri burns to death | C93: 1 Kg 16:18-19 | D93: 1 | E93: 1
A94: =A93+1 -> 93 | B94: The Drought of Elijah | C94: 1 Kg 17:1, Lk 4:25, Jas 5:17-18 | E94: 3000
A95: =A94+1 -> 94 | B95: Elijah kills 450 religious leaders in a prayer contest | C95: 1 Kg 18:22-40 | D95: 450 | E95: 450
A96: =A95+1 -> 95 | B96: The first God-assisted slaughter of the Syrians | C96: 1 Kg 20:20-21 | E96: 10000
A97: =A96+1 -> 96 | B97: God killed 100,000 Syrians for calling him a God of the hills | C97: 1 Kg 20:28-29 | E97: 100000
A98: =A97+1 -> 97 | B98: God killed 27,000 Syrians by making a wall fall on them | C98: 1 Kg 20:30 | D98: 27000 | E98: 27000
A99: =A98+1 -> 98 | B99: God sent a lion to kill a man for not smiting a prophet | C99: 1 Kg 20:35-36 | D99: 1 | E99: 1
A100: =A99+1 -> 99 | B100: God killed Ahab for not killing a captured king | C100: 1 Kg 20:42, 22:35 | D100: 1 | E100: 1
A101: =A100+1 -> 100 | B101: God burned 102 men to death for asking Elijah to come down from his hill | C101: 2 Kg 1:10-12 | D101: 102 | E101: 102
A102: =A101+1 -> 101 | B102: God killed king Ahaziah for asking the wrong God | C102: 2 Kg 1:16-17, 2 Chr 22:709 | D102: 1 | E102: 1
A103: =A102+1 -> 102 | B103: God sent two bears to rip apart 42 boys for making fun of a prophet’s bald head | C103: 2 Kg 2:23-24 | D103: 42 | E103: 42
A104: =A103+1 -> 103 | B104: The Lord delivered the Moabites | C104: 2 Kg 3:18-25 | E104: 5000
A105: =A104+1 -> 104 | B105: A skeptic is trampled to death | C105: 2 Kg 7:2-20 | D105: 1 | E105: 1
A106: =A105+1 -> 105 | B106: God’s seven year famine | C106: 2 Kg 8:1 | E106: 7000
A107: =A106+1 -> 106 | B107: Jehoram of Israel | C107: 2 Kg 9:24 | D107: 1 | E107: 1
A108: =A107+1 -> 107 | B108: Jezebel | C108: 2 Kg 9:33-37 | D108: 1 | E108: 1
A109: =A108+1 -> 108 | B109: Ahab’s sons: Seventy heads in two heaps | C109: 2 Kg 10:6-10 | D109: 70 | E109: 70
A110: =A109+1 -> 109 | B110: Ahab’s hometown family, friends, and priests | C110: 2 Kg 10:11 | E110: 20
A111: =A110+1 -> 110 | B111: Jehu killed Ahaziah's family | C111: 2 Kg 10:12-13, 2 Chr 22:709 | D111: 42 | E111: 42
A112: =A111+1 -> 111 | B112: Jehu and his partner show their zeal for the Lord by killing the rest of Ahab’s family | C112: 2 Kg 10:17 | E112: 20
A113: =A112+1 -> 112 | B113: Jehu assembles the followers of Baal and then slaughters them all | C113: 2 Kg 10:18-25 | E113: 1000
A114: =A113+1 -> 113 | B114: The priest of Baal and Queen Athaliah | C114: 2 Kg 11:17-20 | D114: 2 | E114: 2
A115: =A114+1 -> 114 | B115: God sent lions to eat those that didn’t fear him enough | C115: 2 Kg 17:25-26 | E115: 10
A116: =A115+1 -> 115 | B116: An angel killed 185,000 sleeping soldiers | C116: 2 Kg 19:34, 34:36 | D116: 185000 | E116: 185000
A117: =A116+1 -> 116 | B117: God caused King Sennacherib to be killed by his sons | C117: 2 Kg 19:37, Tob 1:21 | D117: 1 | E117: 1
A118: =A117+1 -> 117 | B118: Josiah killed all the priests of the high places | C118: 2 Kg 23:20 | E118: 100
A119: =A118+1 -> 118 | B119: Just another holy war | C119: 1 Chr 5:18-22 | E119: 50000
A120: =A119+1 -> 119 | B120: God killed a half million Israelite soldiers | C120: 2 Chr 13:17-18 | D120: 500000 | E120: 500000
A121: =A120+1 -> 120 | B121: Jeroboam | C121: 2 Chr 13:20 | D121: 1 | E121: 1
A122: =A121+1 -> 121 | B122: God killed a million Ethiopians | C122: 2 Chr 14:9-14 | D122: 1000000 | E122: 1000000
A123: =A122+1 -> 122 | B123: Friendly Fire: God forced “a great multitude” to kill each other | C123: 2 Chr 20:22-25 | E123: 30000
A124: =A123+1 -> 123 | B124: God made Jehoram’s bowels fall out | C124: 2 Chr 21:14-19 | D124: 1 | E124: 1
A125: =A124+1 -> 124 | B125: God killed Jehoram’s sons | C125: 2 Chr 22:1 | E125: 3
A126: =A125+1 -> 125 | B126: Ahaziah (of Judah) | C126: 2 Chr 22:7-9 | D126: 1 | E126: 1
A127: =A126+1 -> 126 | B127: Joash, the princes, and army of Judah | C127: 2 Chr 24:20-25 | D127: 1 | E127: 10000
A128: =A127+1 -> 127 | B128: God destroyed Amaziah | C128: 2 Chr 25:15-27 | D128: 1 | E128: 1
A129: =A128+1 -> 128 | B129: God smote Ahaz with the king of Syria | C129: 2 Chr 28:1-5 | D129: 1 | E129: 10000
A130: =A129+1 -> 129 | B130: God killed 120,000 valiant men for forsaking him | C130: 2 Chr 28:6 | D130: 120000 | E130: 120000
A131: =A130+1 -> 130 | B131: The fall of Jerusalem | C131: 2 Chr 36:16-17 | E131: 10000
A132: =A131+1 -> 131 | B132: The Purim killings (God hath done these things) | C132: Est 2-9, Est 10:5 (Douay-Reims) | D132: 75813 | E132: 75813
A133: =A132+1 -> 132 | B133: God and Satan kill Job’s children and slaves | C133: Job 1:18-19 | D133: 10 | E133: 60
A134: =A133+1 -> 133 | B134: Hananiah | C134: Jer 28:15-16 | D134: 1 | E134: 1
A135: =A134+1 -> 134 | B135: Ezekiel’s wife | C135: Ezek 24:15-18 | D135: 1 | E135: 1
A136: =A135+1 -> 135 | B136: Judith cuts off a sleeping man's head | C136: Jud 13:6-10 | D136: 1 | E136: 1
A137: =A136+1 -> 136 | B137: The Judith massacre | C137: Jud 15:1-6 | E137: 1000
A138: =A137+1 -> 137 | B138: Mathathias' double murder | C138: 1 Mac 2:24-25 | D138: 2 | E138: 2
A139: =A138+1 -> 138 | B139: God helps Judas Machabeus destroy the wicked | C139: 1 Mac 3:1-26 | D139: 800 | E139: 4900
A140: =A139+1 -> 139 | B140: Ananias and Sapphira | C140: Acts 5:1-10 | D140: 2 | E140: 2
A141: =A140+1 -> 140 | B141: Herod Aggripa | C141: Acts 12:23 | D141: 1 | E141: 1
A142: =A141+1 -> 141 | B142: Jesus | C142: Rom 8:32, 1 Pet 1:18-20 | D142: 1 | E142: 1
D144: =SUM(D2:D153) -> 2301253 | E144: =SUM(E2:E153) -> 24714022